{
  "schema_version": "0.1",
  "snapshot_id": "sha256:0000000000000000000000000000000000000000000000000000000000000000",
  "generation": "fixture-v0.1",
  "type_contracts": [
    {"id": "artifact.file", "version": "1.0", "content_hash": "sha256:0000000000000000000000000000000000000000000000000000000000000001", "source": "type-contracts.json"},
    {"id": "artifact.table", "version": "1.0", "content_hash": "sha256:0000000000000000000000000000000000000000000000000000000000000002", "source": "type-contracts.json"},
    {"id": "artifact.image", "version": "1.0", "content_hash": "sha256:0000000000000000000000000000000000000000000000000000000000000003", "source": "type-contracts.json"},
    {"id": "artifact.report", "version": "1.0", "content_hash": "sha256:0000000000000000000000000000000000000000000000000000000000000004", "source": "type-contracts.json"},
    {"id": "data.table", "version": "1.0", "content_hash": "sha256:0000000000000000000000000000000000000000000000000000000000000005", "source": "type-contracts.json"},
    {"id": "data.metrics", "version": "1.0", "content_hash": "sha256:0000000000000000000000000000000000000000000000000000000000000006", "source": "type-contracts.json"},
    {"id": "data.hash", "version": "1.0", "content_hash": "sha256:0000000000000000000000000000000000000000000000000000000000000007", "source": "type-contracts.json"},
    {"id": "text.plain", "version": "1.0", "content_hash": "sha256:0000000000000000000000000000000000000000000000000000000000000008", "source": "type-contracts.json"},
    {"id": "text.narrative", "version": "1.0", "content_hash": "sha256:0000000000000000000000000000000000000000000000000000000000000009", "source": "type-contracts.json"},
    {"id": "verification.result", "version": "1.0", "content_hash": "sha256:000000000000000000000000000000000000000000000000000000000000000a", "source": "type-contracts.json"}
  ],
  "capability_contracts": [
    {"id": "table.import", "version": "1.0", "content_hash": "sha256:0000000000000000000000000000000000000000000000000000000000000101", "source": "capability-contracts.json"},
    {"id": "table.normalize", "version": "1.0", "content_hash": "sha256:0000000000000000000000000000000000000000000000000000000000000102", "source": "capability-contracts.json"},
    {"id": "stats.compare_periods", "version": "1.0", "content_hash": "sha256:0000000000000000000000000000000000000000000000000000000000000103", "source": "capability-contracts.json"},
    {"id": "chart.render", "version": "1.0", "content_hash": "sha256:0000000000000000000000000000000000000000000000000000000000000104", "source": "capability-contracts.json"},
    {"id": "report.summarize", "version": "1.0", "content_hash": "sha256:0000000000000000000000000000000000000000000000000000000000000105", "source": "capability-contracts.json"},
    {"id": "verify.numeric_claims", "version": "1.0", "content_hash": "sha256:0000000000000000000000000000000000000000000000000000000000000106", "source": "capability-contracts.json"},
    {"id": "document.compose", "version": "1.0", "content_hash": "sha256:0000000000000000000000000000000000000000000000000000000000000107", "source": "capability-contracts.json"},
    {"id": "artifact.hash", "version": "1.0", "content_hash": "sha256:0000000000000000000000000000000000000000000000000000000000000108", "source": "capability-contracts.json"},
    {"id": "artifact.copy", "version": "1.0", "content_hash": "sha256:0000000000000000000000000000000000000000000000000000000000000109", "source": "capability-contracts.json"},
    {"id": "artifact.copy.compat", "version": "1.0", "content_hash": "sha256:000000000000000000000000000000000000000000000000000000000000010a", "source": "capability-contracts.json"},
    {"id": "text.uppercase", "version": "1.0", "content_hash": "sha256:000000000000000000000000000000000000000000000000000000000000010b", "source": "capability-contracts.json"}
  ],
  "created_at": "2026-09-15T00:00:00Z",
  "publisher": null,
  "notes": [
    "STRUCTURAL FIXTURE ONLY: zero-prefixed hashes are placeholders and MUST be replaced by computed canonical hashes when the reference canonicalizer exists."
  ]
}
